{
  "$schema": "http://json-schema.org/draft-07/schema#",
  "$id": "https://web3sec.local/schema/campaign_plan.schema.json",
  "title": "WebSec Campaign Plan",
  "description": "The contract between strategy and execution: the planner (LLM) proposes prioritized questions with trajectories and budgets; the deterministic orchestrator decides whether/when/where each stage runs. The plan is data, never a script the model executes.",
  "type": "object",
  "additionalProperties": false,
  "required": ["campaign_id", "created_at", "priorities"],
  "properties": {
    "campaign_id": { "type": "string" },
    "created_at":  { "type": "string" },
    "snapshot_id": { "type": "string" },
    "strategy_note": { "type": "string" },

    "priorities": {
      "type": "array",
      "minItems": 1,
      "items": {
        "type": "object",
        "additionalProperties": false,
        "required": ["id", "question", "risk", "trajectories"],
        "properties": {
          "id":       { "type": "string", "pattern": "^Q-[0-9]{3}$" },
          "question": { "type": "string", "minLength": 15 },
          "risk":     { "type": "number", "minimum": 0, "maximum": 1 },
          "components": { "type": "array", "items": { "type": "string" } },
          "invariant_ids": { "type": "array", "items": { "type": "string" } },
          "required_context": {
            "type": "array",
            "description": "artifact ids the specialist pass must be given",
            "items": { "type": "string" }
          },
          "trajectories": {
            "type": "array",
            "minItems": 1,
            "items": { "enum": ["code", "economic", "state-machine", "attacker", "historical", "integration", "drift", "lifecycle", "chain"] }
          },
          "recommended_stages": { "type": "array", "items": { "type": "string" } },
          "budget_class": { "enum": ["cheap", "standard", "expensive"], "description": "cheap = local/static, standard = mid model, expensive = frontier model" },
          "success_signal": { "type": "string" },
          "status": { "enum": ["open", "assigned", "answered", "not-applicable", "deprioritized", "blocked"], "default": "open" },
          "closed_reason": { "type": "string", "description": "WHY the priority was closed — required by the CLI for any closing status; 'answered' with no reason or evidence ref is the run-2 hole (Q-004 closed with a sentence instead of a probe)" },
          "closed_ref": { "type": "string", "description": "evidence the closure rests on: a finding id (F-...), exec id (EXEC-...), artifact id, or file#L anchor. An 'answered' priority with no closed_ref is flagged in the report's answer-quality section" },
          "closed_at": { "type": "string" },
          "closed_by": { "type": "string" },
          "passes": { "type": "string", "minLength": 3 },
          "interim": { "type": "string", "minLength": 3, "description": "FIX-5: the deferred-consequence statement pricing the interim window of a tier-0 row anchored on asserter — must cite a symbol from the row's own surface entry" },
          "interim_finding": { "type": "string", "pattern": "^F-[0-9a-f]{12}$", "description": "FIX-5: the filed finding id that records the interim window of a tier-0 row anchored on asserter" },
          "bug_class": { "type": ["string", "null"] },
          "anchor_of": { "type": ["string", "null"] },
          "sibling_of": { "type": ["string", "null"] },
          "probe": {
            "type": "object",
            "description": "the mechanical candidate row this priority was emitted from (A3). row_id is the idempotency key; shape_sha detects a changed anchor tuple, which is the only thing that may reopen a dispositioned row; surface_sha is the index_sha the surface was built from",
            "additionalProperties": false,
            "required": ["row_id", "probe_id", "axis", "surface_sha", "shape_sha"],
            "properties": {
              "row_id": { "type": "string", "pattern": "^[0-9a-f]{10}$" },
              "probe_id": { "type": "string", "minLength": 1,
                            "description": "the registered probe that produced the row; the probe_surface schema pins the enum" },
              "axis": { "type": "string", "minLength": 1 },
              "surface_sha": { "type": "string", "minLength": 1,
                               "description": "index_sha of the surface this row was emitted from" },
              "shape_sha": { "type": "string", "pattern": "^[0-9a-f]{16}$" },
              "risk_band": { "enum": ["high", "medium", "low"],
                             "description": "the probe rank band the numeric risk was mapped from" },
              "anchor": {
                "type": "object",
                "description": "the disposition anchor a probe-row closure cites: the field name from the probe's own anchor enum, its REAL value on the row (probes.row_anchor_value), and the rendered file#L/value citation the closure records as closed_ref. Rejected when the field is outside the probe's enum, so a disposition cannot name a part the probe never produced.",
                "additionalProperties": false,
                "required": ["field", "value", "ref"],
                "properties": {
                  "field": { "type": "string", "minLength": 1 },
                  "value": { "type": ["string", "array", "boolean", "number", "null"] },
                  "ref":   { "type": "string", "minLength": 1 }
                }
              }
            }
          }
        }
      }
    },

    "lenses": {
      "type": "array",
      "items": {
        "type": "object",
        "properties": {
          "id": {"type": "string", "pattern": "^L-[0-9]{2}$"},
          "lens": {"type": "string", "enum": ["liveness", "incentive-inversion",
                                              "enforcement-timing", "primitive-symmetry"]},
          "surface": {"type": "string"},
          "question": {"type": "string"},
          "status": {"type": "string", "enum": ["open", "answered", "not-applicable"]},
          "closed_reason": {"type": ["string", "null"]},
          "closed_ref": {"type": ["string", "null"]},
          "closed_at": {"type": ["string", "null"]},
          "closed_by": {"type": ["string", "null"]},
          "families": {
            "type": "array",
            "items": {"type": "string"},
            "description": "candidate families seeded from the model — the checklist a closure must attest against"
          },
          "families_checked": {
            "type": "array",
            "items": {"type": "string"},
            "description": "families the operator attested as compared/checked when closing"
          },
          "reopen_reason": {"type": ["string", "null"]},
          "reopened_at": {"type": ["string", "null"]},
          "symmetry": {
            "type": "array",
            "description": "primitive-symmetry (L-04) only: the asset-flow pairing per family member — the primitive each sibling uses to move the asset",
            "items": {
              "type": "object",
              "required": ["family", "primitives"],
              "additionalProperties": false,
              "properties": {
                "family": {"type": "string", "minLength": 1},
                "primitives": {
                  "type": "array",
                  "minItems": 1,
                  "items": {"type": "string", "minLength": 1},
                  "description": "the token-movement primitive(s) quoted from source, e.g. burn / safeTransfer / mint"
                }
              }
            }
          }
        },
        "required": ["id", "lens", "surface", "question", "status"],
        "additionalProperties": false
      }
    },

    "trajectory_matrix": {
      "type": "object",
      "description": "enforces orthogonality: each trajectory gets its own perspective contract, and thin-coverage components get re-pointed",
      "additionalProperties": false,
      "properties": {
        "A-code":        { "type": "string", "description": "implementation-centric: bugs in the code as written" },
        "B-economic":    { "type": "string", "description": "assume the protocol is economically exploitable; find the imbalance" },
        "C-state-machine": { "type": "string", "description": "find dangerous call/state sequences and illegal transitions" },
        "D-attacker":    { "type": "string", "description": "assume the attacker holds each realistic role; find role-abuse" },
        "E-historical":  { "type": "string", "description": "find variants of known exploits, patches and disclosures" },
        "F-integration": { "type": "string", "description": "assume every external contract/token behaves unexpectedly" },
        "G-drift":       { "type": "string", "description": "spec vs implementation vs deployment vs config divergence" },
        "H-lifecycle":   { "type": "string", "description": "consensus/lifecycle game: the adversary WINNING the commit→challenge→finalize game" }
      }
    },

    "coverage_targets": {
      "type": "object",
      "additionalProperties": false,
      "properties": {
        "min_invariants":       { "type": "integer", "minimum": 1 },
        "min_trajectories_per_critical_component": { "type": "integer", "minimum": 1 },
        "components_must_cover": { "type": "array", "items": { "type": "string" } }
      }
    }
  }
}
